"Package","Dataset","Description"
"BSDA","Magnesiu","Magnesium concentration and distances between samples"
"BSDA","Malpract","Amounts awarded in 17 malpractice cases"
"BSDA","Manager","Advertised salaries offered general managers of major corporations in 1995"
"BSDA","Marked","Percent of marked cars in 65 police departments in Florida"
"BSDA","Math","Standardized math test scores for 30 students"
"BSDA","Mathcomp","Standardized math competency for a group of entering freshmen at a small community college"
"BSDA","Mathpro","Math proficiency and SAT scores by states"
"BSDA","Maze","Error scores for four groups of experimental animals running a maze"
"BSDA","Median","Illustrates test of equality of medians with the Kruskal Wallis test"
"BSDA","Mental","Median mental ages of 16 girls"
"BSDA","Mercury","Concentration of mercury in 25 lake trout"
"BSDA","Metrent","Monthly rental costs in metro areas with 1 million or more persons"
"BSDA","Miller","Miller personality test scores for a group of college students applying for graduate school"
"BSDA","Miller1","Twenty scores on the Miller personality test"
"BSDA","Moisture","Moisture content and depth of core sample for marine muds in eastern Louisiana"
"BSDA","Monoxide","Carbon monoxide emitted by smoke stacks of a manufacturer and a competitor"
"BSDA","Movie","Moral attitude scale on 15 subjects before and after viewing a movie"
"BSDA","Music","Improvement scores for identical twins taught music recognition by two techniques"
"BSDA","Name","Estimated value of a brand name product and the conpany's revenue"
"BSDA","Nascar","Efficiency of pit crews for three major NASCAR teams"
"BSDA","Nervous","Reaction effects of 4 drugs on 25 subjects with a nervous disorder"
"BSDA","Newsstand","Daily profits for 20 newsstands"
"BSDA","Nfldraf2","Rating, time in 40-yard dash, and weight of top defensive linemen in the 1994 NFL draft"
"BSDA","Nfldraft","Rating, time in 40-yard dash, and weight of top offensive linemen in the 1994 NFL draft"
"BSDA","Nicotine","Nicotine content versus sales for eight major brands of cigarettes"
"BSDA","Orange","Price of oranges versus size of the harvest"
"BSDA","Orioles","Salaries of members of the Baltimore Orioles baseball team"
"BSDA","Oxytocin","Arterial blood pressure of 11 subjects before and after receiving oxytocin"
"BSDA","Parented","Education backgrounds of parents of entering freshmen at a state university"
"BSDA","Patrol","Years of experience and number of tickets given by patrolpersons in New York City"
"BSDA","Pearson","Karl Pearson's data on heights of brothers and sisters"
"BSDA","Phone","Length of long-distance phone calls for a small business firm"
"BSDA","Poison","Number of poisonings reported to 16 poison control centers"
"BSDA","Politic","Political party and gender in a voting district"
"BSDA","Pollutio","Air pollution index for 15 randomly selected days for a major western city"
"BSDA","Porosity","Porosity measurements on 20 samples of Tensleep Sandstone, Pennsylvanian from Bighorn Basin in Wyoming"
"BSDA","Poverty","Percent poverty and crime rate for selected cities"
"BSDA","Precinct","Robbery rates versus percent low income in eight precincts"
"BSDA","Prejudic","Racial prejudice measured on a sample of 25 high school students"
"BSDA","Presiden","Ages at inauguration and death of U.S. presidents"
"BSDA","Press","Degree of confidence in the press versus education level for 20 randomly selected persons"
"BSDA","Prognost","Klopfer's prognostic rating scale for subjects receiving behavior modification therapy"
"BSDA","Program","Effects of four different methods of programmed learning for statistics students"
"BSDA","Psat","PSAT scores versus SAT scores"
"BSDA","Psych","Correct responses for 24 students in a psychology experiment"
"BSDA","Puerto","Weekly incomes of a random sample of 50 Puerto Rican families in Miami"
"BSDA","Quail","Plasma LDL levels in two groups of quail"
"BSDA","Quality","Quality control test scores on two manufacturing processes"
"BSDA","Rainks","Rainfall in an area of west central Kansas and four surrounding counties"
"BSDA","Randd","Research and development expenditures and sales of a large company"
"BSDA","Rat","Survival times of 20 rats exposed to high levels of radiation"
"BSDA","Ratings","Grade point averages versus teacher's ratings"
"BSDA","Reaction","Threshold reaction time for persons subjected to emotional stress"
"BSDA","Reading","Standardized reading scores for 30 fifth graders"
"BSDA","Readiq","Reading scores versus IQ scores"
"BSDA","Referend","Opinion on referendum by view on freedom of the press"
"BSDA","Region","Pollution index taken in three regions of the country"
"BSDA","Register","Maintenance cost versus age of cash registers in a department store"
"BSDA","Rehab","Rehabilitative potential of 20 prison inmates as judged by two psychiatrists"
"BSDA","Remedial","Math placement test score for 35 freshmen females and 42 freshmen males"
"BSDA","Rentals","Weekly rentals for 45 apartments"
"BSDA","Repair","Recorded times for repairing 22 automobiles involved in wrecks"
"BSDA","Retail","Length of employment versus gross sales for 10 employees of a large retail store"
"BSDA","Ronbrown1","Oceanography data obtained at site 1 by scientist aboard the ship Ron Brown"
"BSDA","Ronbrown2","Oceanography data obtained at site 2 by scientist aboard the ship Ron Brown"
"BSDA","Rural","Social adjustment scores for a rural group and a city group of children"
"BSDA","Salary","Starting salaries for 25 new PhD psychologist"
"BSDA","Salinity","Surface-water salinity measurements from Whitewater Bay, Florida"
"BSDA","Sat","SAT scores, percent taking exam and state funding per student by state for 1994, 1995 and 1999"
"BSDA","Saving","Problem asset ration for savings and loan companies in California, New York, and Texas"
"BSDA","Scales","Readings obtained from a 100 pound weight placed on four brands of bathroom scales"
"BSDA","Schizop2","Exam scores for 17 patients to assess the learning ability of schizophrenics after taking a specified does of a tranquilizer"
"BSDA","Schizoph","Standardized exam scores for 13 patients to investigate the learning ability of schizophrenics after a specified dose of a tranquilizer"
"BSDA","Seatbelt","Injury level versus seatbelt usage"
"BSDA","Selfdefe","Self-confidence scores for 9 women before and after instructions on self-defense"
"BSDA","Senior","Reaction times of 30 senior citizens applying for drivers license renewals"
"BSDA","Sentence","Sentences of 41 prisoners convicted of a homicide offense"
"BSDA","Shkdrug","Effects of a drug and electroshock therapy on the ability to solve simple tasks"
"BSDA","Shock","Effect of experimental shock on time to complete difficult task"
"BSDA","Shoplift","Sales receipts versus shoplifting losses for a department store"
"BSDA","Short","James Short's measurements of the parallax of the sun"
"BSDA","Shuttle","Number of people riding shuttle versus number of automobiles in the downtown area"
"BSDA","Simpson","Grade point averages of men and women participating in various sports-an illustration of Simpson's paradox"
"BSDA","Situp","Maximum number of situps by participants in an exercise class"
"BSDA","Skewed","Illustrates the Wilcoxon Rank Sum test"
"BSDA","Skin","Survival times of closely and poorly matched skin grafts on burn patients"
"BSDA","Slc","Sodium-lithium countertransport activity on 190 individuals from six large English kindred"
"BSDA","Smokyph","Water pH levels of 75 water samples taken in the Great Smoky Mountains"
"BSDA","Snore","Snoring versus heart disease"
"BSDA","Snow","Concentration of microparticles in snowfields of Greenland and Antarctica"
"BSDA","Soccer","Weights of 25 soccer players"
"BSDA","Social","Median income level for 25 social workers from North Carolina"
"BSDA","Sophomor","Grade point averages, SAT scores and final grade in college algebra for 20 sophomores"
"BSDA","South","Murder rates for 30 cities in the South"
"BSDA","Speed","Speed reading scores before and after a course on speed reading"
"BSDA","Spellers","Standardized spelling test scores for two fourth grade classes"
"BSDA","Spelling","Spelling scores for 9 eighth graders before and after a 2-week course of instruction"
"BSDA","Sports","Favorite sport by gender"
"BSDA","Spouse","Convictions in spouse murder cases by gender"
"BSDA","Stable","Times of a 2-year old stallion on a one mile run"
"BSDA","Stamp","Thicknesses of 1872 Hidalgo stamps issued in Mexico"
"BSDA","Statclas","Grades for two introductory statistics classes"
"BSDA","Statelaw","Operating expenditures per resident for each of the state law enforcement agencies"
"BSDA","Statisti","Test scores for two beginning statistics classes"
"BSDA","Step","STEP science test scores for a class of ability-grouped students"
"BSDA","Stress","Short-term memory test scores on 12 subjects before and after a stressful situation"
"BSDA","Study","Number of hours studied per week by a sample of 50 freshmen"
"BSDA","Submarin","Number of German submarines sunk by U.S. Navy in World War II"
"BSDA","Subway","Time it takes a subway to travel from the airport to downtown"
"BSDA","Sunspot","Wolfer sunspot numbers from 1700 through 2000"
"BSDA","Superbowl","Margin of victory in Superbowls I to XXXV"
"BSDA","Supercar","Top speeds attained by five makes of supercars"
"BSDA","Tablrock","Ozone concentrations at Mt. Mitchell, North Carolina"
"BSDA","Teacher","Average teacher's salaries across the states in the 70s 80s and 90s"
"BSDA","Tenness","Tennessee self concept scores for 20 gifted high school students"
"BSDA","Tensile","Tensile strength of plastic bags from two production runs"
"BSDA","Test1","Grades on the first test in a statistics class"
"BSDA","Thermal","Heat loss of thermal pane windows versus outside temperature"
"BSDA","Tiaa","1999-2000 closing prices for TIAA-CREF stocks"
"BSDA","Ticket","Time to complete an airline ticket reservation"
"BSDA","Toaster","Consumer Reports (Oct 94) rating of toaster ovens versus the cost"
"BSDA","Tonsils","Size of tonsils collected from 1,398 children"
"BSDA","Tort","The number of torts, average number of months to process a tort, and county population from the court files of the nation's largest counties"
"BSDA","Toxic","Hazardous waste sites near minority communities"
"BSDA","Track","National Olympic records for women in several races"
"BSDA","Track15","Olympic winning times for the men's 1500-meter run"
"BSDA","Treatments","Illustrates analysis of variance for three treatment groups"
"BSDA","Trees","Number of trees in 20 grids"
"BSDA","Trucks","Miles per gallon for standard 4-wheel drive trucks manufactured by Chevrolet, Dodge and Ford"
"BSDA","Tv","Percent of students that watch more than 6 hours of TV per day versus national math test scores"
"BSDA","Twin","Intelligence test scores for identical twins in which one twin is given a drug"
"BSDA","Undergrad","Data set describing a sample of undergraduate students"
"BSDA","Vacation","Number of days of paid holidays and vacation leave for sample of 35 textile workers"
"BSDA","Vaccine","Reported serious reactions due to vaccines in 11 southern states"
"BSDA","Vehicle","Fatality ratings for foreign and domestic vehicles"
"BSDA","Verbal","Verbal test scores and number of library books checked out for 15 eighth graders"
"BSDA","Victoria","Number of sunspots versus mean annual level of Lake Victoria Nyanza from 1902 to 1921"
"BSDA","Viscosit","Viscosity measurements of a substance on two different days"
"BSDA","Visual","Visual acuity of a group of subjects tested under a specified dose of a drug"
"BSDA","Vocab","Reading scores before and after vocabulary training for 14 employees who did not complete high school"
"BSDA","Wastewat","Volume of injected waste water from Rocky Mountain Arsenal and number of earthquakes near Denver"
"BSDA","Weather94","Weather casualties in 1994"
"BSDA","Wheat","Price of a bushel of wheat versus the national weekly earnings of production workers"
"BSDA","Windmill","Direct current produced by different wind velocities"
"BSDA","Window","Wind leakage for storm windows exposed to a 50 mph wind"
"BSDA","Wins","Baseball team wins versus seven independent variables for National league teams in 1990"
"BSDA","Wool","Strength tests of two types of wool fabric"
"BSDA","Yearsunspot","Monthly sunspot activity from 1974 to 2000"
"carData","AMSsurvey","American Math Society Survey Data"
"carData","Adler","Experimenter Expectations"
"carData","Angell","Moral Integration of American Cities"
"carData","Anscombe","U. S. State Public-School Expenditures"
"carData","Arrests","Arrests for Marijuana Possession"
"carData","BEPS","British Election Panel Study"
"carData","Baumann","Methods of Teaching Reading Comprehension"
"carData","Bfox","Canadian Women's Labour-Force Participation"
"carData","Blackmore","Exercise Histories of Eating-Disordered and Control Subjects"
"carData","Burt","Fraudulent Data on IQs of Twins Raised Apart"
"carData","CES11","2011 Canadian National Election Study, With Attitude Toward Abortion"
"carData","CanPop","Canadian Population Data"
"carData","Chile","Voting Intentions in the 1988 Chilean Plebiscite"
"carData","Chirot","The 1907 Romanian Peasant Rebellion"
"carData","Cowles","Cowles and Davis's Data on Volunteering"
"carData","Davis","Self-Reports of Height and Weight"
"carData","DavisThin","Davis's Data on Drive for Thinness"
"carData","Depredations","Minnesota Wolf Depredation Data"
"carData","Duncan","Duncan's Occupational Prestige Data"
"carData","Ericksen","The 1980 U.S. Census Undercount"
"carData","Florida","Florida County Voting"
"carData","Freedman","Crowding and Crime in U. S. Metropolitan Areas"
"carData","Friendly","Format Effects on Recall"
"carData","GSSvocab","Data from the General Social Survey (GSS) from the National Opinion Research Center of the University of Chicago."
"carData","Ginzberg","Data on Depression"
"carData","Greene","Refugee Appeals"
"carData","Guyer","Anonymity and Cooperation"
"carData","Hartnagel","Canadian Crime-Rates Time Series"
"carData","Highway1","Highway Accidents"
"carData","KosteckiDillon","Treatment of Migraine Headaches"
"carData","Leinhardt","Data on Infant-Mortality"
"carData","LoBD","Cancer drug data use to provide an example of the use of the skew power distributions."
"carData","Mandel","Contrived Collinear Data"
"carData","Migration","Canadian Interprovincial Migration Data"
"carData","Moore","Status, Authoritarianism, and Conformity"
"carData","MplsDemo","Minneapolis Demographic Data 2015, by Neighborhood"
"carData","MplsStops","Minneapolis Police Department 2017 Stop Data"
"carData","Mroz","U.S. Women's Labor-Force Participation"
"carData","OBrienKaiser","O'Brien and Kaiser's Repeated-Measures Data"
"carData","OBrienKaiserLong","O'Brien and Kaiser's Repeated-Measures Data in ""Long"" Format"
"carData","Ornstein","Interlocking Directorates Among Major Canadian Firms"
"carData","Pottery","Chemical Composition of Pottery"
"carData","Prestige","Prestige of Canadian Occupations"
"carData","Quartet","Four Regression Datasets"
"carData","Robey","Fertility and Contraception"
"carData","Rossi","Rossi et al.'s Criminal Recidivism Data"
"carData","SLID","Survey of Labour and Income Dynamics"
"carData","Sahlins","Agricultural Production in Mazulu Village"
"carData","Salaries","Salaries for Professors"
"carData","Soils","Soil Compositions of Physical and Chemical Characteristics"
"carData","States","Education and Related Statistics for the U.S. States"
"carData","TitanicSurvival","Survival of Passengers on the Titanic"
"carData","Transact","Transaction data"
"carData","UN","National Statistics from the United Nations, Mostly From 2009-2011"
"carData","UN98","United Nations Social Indicators Data 1998]"
"carData","USPop","Population of the United States"
"carData","Vocab","Vocabulary and Education"
"carData","WVS","World Values Surveys"
"carData","WeightLoss","Weight Loss Data"
"carData","Wells","Well Switching in Bangladesh"
"carData","Womenlf","Canadian Women's Labour-Force Participation"
"carData","Wong","Post-Coma Recovery of IQ"
"carData","Wool","Wool data"
"caret","GermanCredit","German Credit Data"
"caret","Sacramento","Sacramento CA Home Prices"
"caret","absorp (tecator)","Fat, Water and Protein Content of Meat Samples"
"caret","bbbDescr (BloodBrain)","Blood Brain Barrier Data"
"caret","cars","Kelly Blue Book resale data for 2005 model year GM cars"
"caret","cox2Class (cox2)","COX-2 Activity Data"
"caret","cox2Descr (cox2)","COX-2 Activity Data"
"caret","cox2IC50 (cox2)","COX-2 Activity Data"
"caret","dhfr","Dihydrofolate Reductase Inhibitors Data"
"caret","endpoints (tecator)","Fat, Water and Protein Content of Meat Samples"
"caret","fattyAcids (oil)","Fatty acid composition of commercial oils"
"caret","logBBB (BloodBrain)","Blood Brain Barrier Data"
"caret","mdrrClass (mdrr)","Multidrug Resistance Reversal (MDRR) Agent Data"
"caret","mdrrDescr (mdrr)","Multidrug Resistance Reversal (MDRR) Agent Data"
"caret","oilType (oil)","Fatty acid composition of commercial oils"
"caret","potteryClass (pottery)","Pottery from Pre-Classical Sites in Italy"
"caret","scat","Morphometric Data on Scat"
"caret","scat_orig (scat)","Morphometric Data on Scat"
"caret","segmentationData","Cell Body Segmentation"
"clock","clock_iso_weekdays","Integer codes"
"clock","clock_months","Integer codes"
"clock","clock_weekdays","Integer codes"
"clue","CKME","Cassini Data Partitions Obtained by K-Means"
"clue","Cassini","Cassini Data"
"clue","GVME","Gordon-Vichi Macroeconomic Partition Ensemble Data"
"clue","GVME_Consensus","Gordon-Vichi Macroeconomic Consensus Partition Data"
"clue","Kinship82","Rosenberg-Kim Kinship Terms Partition Data"
"clue","Kinship82_Consensus","Gordon-Vichi Kinship82 Consensus Partition Data"
"clue","Phonemes","Miller-Nicely Consonant Phoneme Confusion Data"
"cluster","agriculture","European Union Agricultural Workforces"
"cluster","animals","Attributes of Animals"
"cluster","chorSub","Subset of C-horizon of Kola Data"
"cluster","flower","Flower Characteristics"
"cluster","plantTraits","Plant Species Traits Data"
"cluster","pluton","Isotopic Composition Plutonium Batches"
"cluster","ruspini","Ruspini Data"
"cluster","votes.repub","Votes for Republican Candidate in Presidential Elections"
"cluster","xclara","Bivariate Data Set with 3 Clusters"
"clusterProfiler","DE_GSE8057","Datasets gcSample contains a sample of gene clusters."
"clusterProfiler","gcSample","Datasets gcSample contains a sample of gene clusters."
"clusterProfiler","kegg_species","Datasets gcSample contains a sample of gene clusters."
"coda","line","Simple linear regression example"
"coin","CWD","Coarse Woody Debris"
"coin","GTSG","Gastrointestinal Tumor Study Group"
"coin","alpha","Genetic Components of Alcoholism"
"coin","alzheimer","Smoking and Alzheimer's Disease"
"coin","asat","Toxicological Study on Female Wistar Rats"
"coin","glioma","Malignant Glioma Pilot Study"
"coin","hohnloser","Left Ventricular Ejection Fraction"
"coin","jobsatisfaction","Income and Job Satisfaction"
"coin","malformations","Maternal Drinking and Congenital Sex Organ Malformation"
"coin","mercuryfish","Chromosomal Effects of Mercury-Contaminated Fish Consumption"
"coin","neuropathy","Acute Painful Diabetic Neuropathy"
"coin","ocarcinoma","Ovarian Carcinoma"
"coin","photocar","Multiple Dosing Photococarcinogenicity Experiment"
"coin","rotarod","Rotating Rats"
"coin","treepipit","Tree Pipits in Franconian Oak Forests"
"coin","vision","Unaided Distance Vision"
"colorspace","USSouthPolygon","Polygon for County Map of US South States: Alabama, Georgia, and South Carolina"
"colorspace","max_chroma_table","Compute Maximum Chroma for Given Hue and Luminance in HCL"
"deldir","grapherXmpl","grapherXmpl"
"deldir","niProperties","Northern Ireland properties."
"deldir","seaweed","seaweed"
"deldir","toyPattern","A toy marked point pattern object, with 59 points."
"deldir","volTriPoints","Solute plume concentration data set."
"dendextend","khan","Microarray gene expression dataset from Khan et al., 2001. Subset of 306 genes."
"DescTools","cards","Datasets for Probabilistic Simulation"
"DescTools","d.countries","ISO 3166-1 Country Codes"
"DescTools","d.diamonds","Data diamonds"
"DescTools","d.periodic","Periodic Table of Elements"
"DescTools","d.pizza","Data pizza"
"DescTools","d.prefix","Unit Conversion and Metrix Prefixes"
"DescTools","d.units","Unit Conversion and Metrix Prefixes"
"DescTools","d.whisky","Classification of Scotch Single Malts"
"DescTools","day.abb","Build-in Constants Extension"
"DescTools","day.name","Build-in Constants Extension"
"DescTools","hblue","Some Custom Palettes"
"DescTools","hecru","Some Custom Palettes"
"DescTools","hgreen","Some Custom Palettes"
"DescTools","horange","Some Custom Palettes"
"DescTools","hred","Some Custom Palettes"
"DescTools","hyellow","Some Custom Palettes"
"DescTools","roulette","Datasets for Probabilistic Simulation"
"DescTools","tarot","Datasets for Probabilistic Simulation"
"DescTools","wdConst","Word VBA Constants"
"DescTools","xlConst","Word VBA Constants"
"diagram","Rigaweb (rigaweb)","Gulf of Riga autumn planktonic food web"
"diagram","Takapotoweb (takapotoweb)","Takapoto atoll planktonic food web"
"diagram","Teasel","Population dynamics model transition matrix of teasel"
"DiagrammeR","currencies","ISO-4217 currency data."
"DiagrammeR","edge_list_1","Edge list - Version 1."
"DiagrammeR","edge_list_2","Edge list - Version 2."
"DiagrammeR","node_list_1","Node list - Version 1."
"DiagrammeR","node_list_2","Node list - Version 2."
"DiagrammeR","usd_exchange_rates","US Dollar exchange rates."
"DiceDesign","NOLHDRdesigns","List of De Rainville's Nearly Orthogonal Latin Hypercubes designs"
"DiceDesign","NOLHdesigns","List of Cioppa's Nearly Orthogonal Latin Hypercubes designs"
"DiceDesign","OA131","A 3D orthogonal array of strength 2"
"DiceDesign","OA131_scrambled","A scrambled 3D orthogonal array of strength 2"
"doBy","NIRmilk","NIRmilk"
"doBy","beets","beets data"
"doBy","breastcancer","Gene expression signatures for p53 mutation status in 250 breast cancer samples"
"doBy","budworm","Budworm data"
"doBy","cad1","Coronary artery disease data"
"doBy","cad2","Coronary artery disease data"
"doBy","carcass","Lean meat contents of 344 pig carcasses"
"doBy","carcassall","Lean meat contents of 344 pig carcasses"
"doBy","codstom","Diet of Atlantic cod in the Gulf of St. Lawrence (Canada)"
"doBy","crickets","crickets data"
"doBy","crimeRate","crimeRate"
"doBy","crime_rate","crimeRate"
"doBy","cropyield","Yield from Danish agricultural production of grain and root crop."
"doBy","dietox","Growth curves of pigs in a 3x3 factorial experiment"
"doBy","fatacid","Fish oil in pig food"
"doBy","fev","Forced expiratory volume in children"
"doBy","haldCement","Heat development in cement under hardening."
"doBy","income","income data"
"doBy","math","Mathematics marks for students"
"doBy","mathmark","Mathematics marks for students"
"doBy","milkman","Milk yield data for manually milked cows."
"doBy","milkman_rdm1","Milk yield data for manually milked cows."
"doBy","nir_milk","nir_milk"
"doBy","personality","Personality traits"
"doBy","potatoes","Weight and size of 20 potatoes"
"doBy","prostate","Prostate Tumor Gene Expression Dataset"
"DOSE","DGN_EXTID2PATHID","Datasets"
"DOSE","DGN_PATHID2EXTID","Datasets"
"DOSE","DGN_PATHID2NAME","Datasets"
"DOSE","DO2ALLEG","Datasets"
"DOSE","DO2EG","Datasets"
"DOSE","DOIC","Datasets"
"DOSE","DOLite2EG","Datasets"
"DOSE","DOLiteTerm","Datasets"
"DOSE","EG2ALLDO","Datasets"
"DOSE","EG2DO","Datasets"
"DOSE","EG2DOLite","Datasets"
"DOSE","NCG_EXTID2PATHID","Datasets"
"DOSE","NCG_PATHID2EXTID","Datasets"
"DOSE","NCG_PATHID2NAME","Datasets"
"DOSE","VDGN_EXTID2PATHID","Datasets"
"DOSE","VDGN_PATHID2EXTID","Datasets"
"DOSE","VDGN_PATHID2NAME","Datasets"
"DOSE","dotbl","Datasets"
"DOSE","geneList","Datasets"
"dplyr","band_instruments","Band membership"
"dplyr","band_instruments2","Band membership"
"dplyr","band_members","Band membership"
"dplyr","starwars","Starwars characters"
"dplyr","storms","Storm tracks data"
"dunn.test","homecare","Occupation and Home Care Eligibility"
"emmeans","MOats","Oats data in multivariate form"
"emmeans","auto.noise (autonoise)","Auto Pollution Filter Noise"
"emmeans","feedlot","Feedlot data"
"emmeans","fiber","Fiber data"
"emmeans","neuralgia","Neuralgia data"
"emmeans","nutrition","Nutrition data"
"emmeans","oranges","Sales of oranges"
"emmeans","pigs","Effects of dietary protein on free plasma leucine concentration in pigs"
"emmeans","ubds","Unbalanced dataset"
"expm","matStig","Stig's ""infamous"" Example Matrix"
"factoextra","decathlon2","Athletes' performance in decathlon"
"factoextra","housetasks","House tasks contingency table"
"factoextra","multishapes","A dataset containing clusters of multiple shapes"
"factoextra","poison","Poison"
"FactoMineR","JO","Number of medals in athletism during olympic games per country"
"FactoMineR","children","Children (data)"
"FactoMineR","decathlon","Performance in decathlon (data)"
"FactoMineR","footsize","footsize"
"FactoMineR","geomorphology","geomorphology(data)"
"FactoMineR","health","health (data)"
"FactoMineR","hobbies","hobbies (data)"
"FactoMineR","milk","milk"
"FactoMineR","mortality","The cause of mortality in France in 1979 and 2006"
"FactoMineR","poison","Poison"
"FactoMineR","poison.text","Poison"
"FactoMineR","poulet","Genomic data for chicken"
"FactoMineR","senso","senso"
"FactoMineR","tea","tea (data)"
"FactoMineR","wine","Wine"
"fgsea","exampleExpressionMatrix","Example of expression values obtained for GSE14308."
"fgsea","examplePathways","Example list of mouse Reactome pathways."
"fgsea","exampleRanks","Example vector of gene-level statistics obtained for Th1 polarization."
"forcats","gss_cat","A sample of categorical variables from the General Social survey"
"gapminder","continent_colors","Gapminder color schemes."
"gapminder","country_codes","Country codes"
