"Package","Dataset","Description"
"gapminder","country_colors","Gapminder color schemes."
"gapminder","gapminder","Gapminder data"
"gapminder","gapminder_unfiltered","Gapminder data, unfiltered."
"GenomeInfoDbData","specData","Species and taxonomy ID look up tables"
"geoR","Ksat","Saturated Hydraulic Conductivity"
"geoR","ca20","Calcium content in soil samples"
"geoR","camg","Calcium and magnesium content in soil samples"
"geoR","elevation","Surface Elevations"
"geoR","gambia","Gambia Malaria Data"
"geoR","gambia.borders (gambia)","Gambia Malaria Data"
"geoR","gambia.map (gambia)","Gambia Malaria Data"
"geoR","head","Head observations in a regional confined aquifer"
"geoR","hoef","Data for spatial analysis of experiments"
"geoR","isaaks","Data from Isaaks and Srisvastava's book"
"geoR","kattegat","Kattegat basin salinity data"
"geoR","landim1","Data from Landim's book"
"geoR","parana","Rainfall Data from Parana State, Brasil"
"geoR","rongelap","Radionuclide Concentrations on Rongelap Island"
"geoR","s100","Simulated Data-Sets which Illustrate the Usage of the Package geoR"
"geoR","s121","Simulated Data-Sets which Illustrate the Usage of the Package geoR"
"geoR","s256i","Simulated Data-Set which Illustrate the Usage of krige.bayes"
"geoR","sic.100 (SIC)","Spatial Interpolation Comparison data"
"geoR","sic.367 (SIC)","Spatial Interpolation Comparison data"
"geoR","sic.all (SIC)","Spatial Interpolation Comparison data"
"geoR","sic.borders (SIC)","Spatial Interpolation Comparison data"
"geoR","sic.some (SIC)","Spatial Interpolation Comparison data"
"geoR","soil250","Soil chemistry properties data set"
"geoR","soja98","Soya bean production and other variables in a uniformity trial"
"geoR","tce","TCE concentrations in groundwater in a vertical cross section"
"geoR","wo","Kriging example data from Webster and Oliver"
"geoR","wolfcamp","Wolfcamp Aquifer Data"
"geoR","wrc","Points of a water retention curve data set"
"GGally","australia_PISA2012","Programme for International Student Assessment (PISA) 2012 Data for Australia"
"GGally","baseball","Yearly batting records for all major league baseball players"
"GGally","flea","Historical data used for classification examples."
"GGally","happy","Data related to happiness from the General Social Survey, 1972-2006."
"GGally","nasa","Data from the Data Expo JSM 2006."
"GGally","pigs","United Kingdom Pig Production"
"GGally","psychademic","UCLA canonical correlation analysis data"
"GGally","tips","Tipping data"
"GGally","twitter_spambots","Twitter spambots"
"ggmap","crime","Crime data"
"ggmap","hadley","Highly unofficial ggplot2 image"
"ggmap","wind","Wind data from Hurricane Ike"
"ggmap","zips","Zip code data for the Greater Houston Metropolitan Area from the 2000 census"
"ggplot2","diamonds","Prices of over 50,000 round cut diamonds"
"ggplot2","economics","US economic time series"
"ggplot2","economics_long","US economic time series"
"ggplot2","faithfuld","2d density estimate of Old Faithful data"
"ggplot2","luv_colours","'colors()' in Luv space"
"ggplot2","midwest","Midwest demographics"
"ggplot2","mpg","Fuel economy data from 1999 to 2008 for 38 popular models of cars"
"ggplot2","msleep","An updated and expanded version of the mammals sleep dataset"
"ggplot2","presidential","Terms of 12 presidents from Eisenhower to Trump"
"ggplot2","seals","Vector field of seal movements"
"ggplot2","txhousing","Housing sales in TX"
"ggpubr","diff_express","Differential gene expression analysis results"
"ggpubr","gene_citation","Gene Citation Index"
"ggpubr","gene_expression","Gene Expression Data"
"ggraph","flare","The class hierarchy of the flare visualization library"
"ggraph","highschool","Friendship among high school boys"
"ggraph","whigs","Membership network of American Whigs"
"ggvis","cocaine","Cocaine seizures in the US."
"glmnet","BinomialExample","Synthetic dataset with binary response"
"glmnet","CoxExample","Synthetic dataset with right-censored survival response"
"glmnet","MultiGaussianExample","Synthetic dataset with multiple Gaussian responses"
"glmnet","MultinomialExample","Synthetic dataset with multinomial response"
"glmnet","PoissonExample","Synthetic dataset with count response"
"glmnet","QuickStartExample","Synthetic dataset with Gaussian response"
"glmnet","SparseExample","Synthetic dataset with sparse design matrix"
"glmnet","beta_CVX (CVXResults)","Simulated data for the glmnet vignette"
"gmp","Oakley1","RFC 2409 Oakley Groups - Parameters for Diffie-Hellman Key Exchange"
"gmp","Oakley2","RFC 2409 Oakley Groups - Parameters for Diffie-Hellman Key Exchange"
"googleVis","Andrew","Hurricane Andrew: googleVis example data set"
"googleVis","Cairo","Daily temperature data for Cairo"
"googleVis","Cats","Cat Search Terms"
"googleVis","CityPopularity","CityPopularity: googleVis example data set"
"googleVis","Exports","Exports: googleVis example data set"
"googleVis","Fruits","Fruits: googleVis example data set"
"googleVis","OpenClose","OpenClose: googleVis example data set"
"googleVis","Population","Population: googleVis example data set"
"googleVis","Regions","Regions: googleVis example data set"
"googleVis","Stock","Stock: googleVis example data set"
"googleVis","dino","Dinosaur data"
"GOSemSim","gotbl","Information content of GO terms"
"GPArotation","Harman8 (Harman)","Example Data from Harman"
"GPArotation","NetherlandsTV (WansbeekMeijer)","Factor Example from Wansbeek and Meijer"
"GPArotation","box20 (Thurstone)","Example Data from Thurstone"
"GPArotation","box26 (Thurstone)","Example Data from Thurstone"
"graphlayouts","metro_berlin","Subway network of Berlin"
"graphlayouts","multilvl_ex","Multilevel example Network"
"hardhat","example_test (hardhat-example-data)","Example data for hardhat"
"hardhat","example_train (hardhat-example-data)","Example data for hardhat"
"htmlTable","SCB","Average age in Sweden"
"impute","khanmiss","Khan microarray data with random missing values"
"infer","gss","Subset of data from the General Social Survey (GSS)."
"interp","akima","Waveform Distortion Data for Bivariate Interpolation"
"interp","akima474","Sample data from Akima's Bicubic Spline Interpolation code (TOMS 474)"
"interp","circtest","circtest / sample data"
"interp","circtest2","circtest / sample data"
"interp","franke","Test datasets from Franke for interpolation of scattered data"
"interp","tritest","tritest / sample data"
"investr","arsenic","Concentrations of arsenic in water samples"
"investr","beetle","Dobson's Beetle Data"
"investr","bladder","Bladder volume data"
"investr","crystal","Crystal weight data"
"investr","nasturtium","Bioassay on Nasturtium"
"investr","whisky","Whisky data"
"ipred","DLBCL","Diffuse Large B-Cell Lymphoma"
"ipred","GlaucomaMVF","Glaucoma Database"
"ipred","Smoking","Smoking Styles"
"ipred","dystrophy","Detection of muscular dystrophy carriers."
"jomo","ExamScores","Exam results for six inner London Education Authorities"
"jomo","JSPmiss","Exam results for six inner London Education Authorities"
"jomo","cldata","A simulated clustered dataset"
"jomo","sldata","A simulated single level dataset"
"jomo","surdata","A simulated dataset with survival data"
"jomo","tldata","A simulated 2-level dataset"
"kSamples","ShorelineFireEMS","Shoreline Fire and EMS Turnout Times"
"laeken","eusilc","Synthetic EU-SILC survey data"
"laeken","ses","Synthetic SES survey data"
"lars","diabetes","Blood and other measurements in diabetics"
"lattice","USMortality","Mortality Rates in US by Cause and Gender"
"lattice","USRegionalMortality","Mortality Rates in US by Cause and Gender"
"lattice","barley","Yield data from a Minnesota barley trial"
"lattice","environmental","Atmospheric environmental conditions in New York City"
"lattice","ethanol","Engine exhaust fumes from burning ethanol"
"lattice","melanoma","Melanoma skin cancer incidence"
"lattice","singer","Heights of New York Choral Society singers"
"lava","bmd","Longitudinal Bone Mineral Density Data (Wide format)"
"lava","bmidata","Data"
"lava","brisa","Simulated data"
"lava","calcium","Longitudinal Bone Mineral Density Data"
"lava","hubble","Hubble data"
"lava","hubble2","Hubble data"
"lava","indoorenv","Data"
"lava","missingdata","Missing data example"
"lava","nldata","Example data (nonlinear model)"
"lava","nsem","Example SEM data (nonlinear)"
"lava","semdata","Example SEM data"
"lava","serotonin","Serotonin data"
"lava","serotonin2","Data"
"lava","twindata","Twin menarche data"
"leaflet","atlStorms2005","Atlantic Ocean storms 2005"
"leaflet","breweries91","Selected breweries in Franconia"
"leaflet","gadmCHE","Administrative borders of Switzerland (level 1)"
"likert","MathAnxiety","Pre-summarized results from an administration of the Math Anxiety Scale Survey."
"likert","MathAnxietyGender","Pre-summarized results from an administration of the Math Anxiety Scale Survey grouped by gender."
"likert","gap","Fictitious dataset with importance and satisfaction results across five different offices."
"likert","mass","Results from an administration of the Math Anxiety Scale Survey."
"likert","pisaitems","Programme of International Student Assessment"
"likert","sasr","Results from the Survey of Academic Self-Regulation (SASR)."
"lme4","Arabidopsis","Arabidopsis clipping/fertilization data"
"lme4","Dyestuff","Yield of dyestuff by batch"
"lme4","Dyestuff2","Yield of dyestuff by batch"
"lme4","InstEval","University Lecture/Instructor Evaluations by Students at ETH"
"lme4","Pastes","Paste strength by batch and cask"
"lme4","Penicillin","Variation in penicillin testing"
"lme4","VerbAgg","Verbal Aggression item responses"
"lme4","cake","Breakage Angle of Chocolate Cakes"
"lme4","cbpp","Contagious bovine pleuropneumonia"
"lme4","grouseticks","Data on red grouse ticks from Elston et al. 2001"
"lme4","grouseticks_agg (grouseticks)","Data on red grouse ticks from Elston et al. 2001"
"lme4","sleepstudy","Reaction times in a sleep deprivation study"
"lmtest","ChickEgg","Chickens, Eggs, and Causality"
"lmtest","Mandible","Mandible Data"
"lmtest","USDistLag","US Macroeconomic Data"
"lmtest","bondyield","Bond Yield"
"lmtest","currencysubstitution","Currency Substitution"
"lmtest","ftemp","Femal Temperature Data"
"lmtest","fyff","U.S. Macroeconomic Time Series"
"lmtest","gmdc","U.S. Macroeconomic Time Series"
"lmtest","growthofmoney","Growth of Money Supply"
"lmtest","ip","U.S. Macroeconomic Time Series"
"lmtest","jocci","U.S. Macroeconomic Time Series"
"lmtest","lhur","U.S. Macroeconomic Time Series"
"lmtest","moneydemand","Money Demand"
"lmtest","pw561","U.S. Macroeconomic Time Series"
"lmtest","unemployment","Unemployment Data"
"lmtest","valueofstocks","Value of Stocks"
"lmtest","wages","Wages"
"locfit","ais","Australian Institute of Sport Dataset"
"locfit","bad","Example dataset for bandwidth selection"
"locfit","border","Cricket Batting Dataset"
"locfit","chemdiab","Chemical Diabetes Dataset"
"locfit","claw54","Claw Dataset"
"locfit","cldem","Example data set for classification"
"locfit","cltest","Test dataset for classification"
"locfit","cltrain","Training dataset for classification"
"locfit","co2","Carbon Dioxide Dataset"
"locfit","diab","Exhaust emissions"
"locfit","ethanol","Exhaust emissions"
"locfit","geyser","Old Faithful Geyser Dataset"
"locfit","geyser.round","Discrete Old Faithful Geyser Dataset"
"locfit","heart","Survival Times of Heart Transplant Recipients"
"locfit","insect","Insect Dataset"
"locfit","iris","Fisher's Iris Data (subset)"
"locfit","kangaroo","Kangaroo skull measurements dataset"
"locfit","livmet","liver Metastases dataset"
"locfit","mcyc","Acc(De?)celeration of a Motorcycle Hitting a Wall"
"locfit","mine","Fracture Counts in Coal Mines"
"locfit","mmsamp","Test dataset for minimax Local Regression"
"locfit","morths","Henderson and Sheppard Mortality Dataset"
"locfit","penny","Penny Thickness Dataset"
"locfit","spencer","Spencer's Mortality Dataset"
"locfit","stamp","Stamp Thickness Dataset"
"locfit","trimod","Generated sample from a bivariate trimodal normal mixture"
"loo","Kline","Datasets for loo examples and vignettes"
"loo","milk","Datasets for loo examples and vignettes"
"loo","voice","Datasets for loo examples and vignettes"
"loo","voice_loo","Datasets for loo examples and vignettes"
"lubridate","lakers","Lakers 2008-2009 basketball data set"
"MALDIquant","fiedler2009subset","Example Mass Spectra (raw)"
"maps","canada.cities","Database of Canadian cities"
"maps","county.fips","FIPS county codes for US County Map"
"maps","countyMapEnv","United States County Map"
"maps","franceMapEnv","France Map"
"maps","iso3166","ISO 3166 country codes (2 or 3 letters) and sovereignty."
"maps","italyMapEnv","Italy Map"
"maps","lakesMapEnv","World lakes database"
"maps","nzMapEnv","New Zealand Basic Map"
"maps","ozone","Sample datasets"
"maps","state.carto.center","United States State Population Cartogram Map"
"maps","state.cartoMapEnv","United States State Population Cartogram Map"
"maps","state.fips","FIPS state codes for US 48 State Map"
"maps","state.vbm.center","United States State Visibility Base Map"
"maps","state.vbmMapEnv","United States State Visibility Base Map"
"maps","stateMapEnv","United States State Boundaries Map"
"maps","unemp","Sample datasets"
"maps","us.cities","Database of US cities"
"maps","usaMapEnv","United States Coast Map"
"maps","votes.repub","Sample datasets"
"maps","world.cities","Database of world cities"
"maps","world2MapEnv","Pacific Centric Low resolution World Map"
"maps","worldMapEnv","Low (mid) resolution World Map"
"maptools","SplashDams","Data for Splash Dams in western Oregon"
"maptools","h1pl (gpcholes)","Hisaji Ono's lake/hole problem"
"maptools","h2pl (gpcholes)","Hisaji Ono's lake/hole problem"
"maptools","state.vbm","US State Visibility Based Map"
"maptools","wrld_simpl","Simplified world country polygons"
"MASS","Aids2","Australian AIDS Survival Data"
"MASS","Animals","Brain and Body Weights for 28 Species"
"MASS","Boston","Housing Values in Suburbs of Boston"
"MASS","Cars93","Data from 93 Cars on Sale in the USA in 1993"
"MASS","Cushings","Diagnostic Tests on Patients with Cushing's Syndrome"
"MASS","DDT","DDT in Kale"
"MASS","GAGurine","Level of GAG in Urine of Children"
"MASS","Insurance","Numbers of Car Insurance claims"
"MASS","Melanoma","Survival from Malignant Melanoma"
"MASS","OME","Tests of Auditory Perception in Children with OME"
"MASS","Pima.te","Diabetes in Pima Indian Women"
"MASS","Pima.tr","Diabetes in Pima Indian Women"
"MASS","Pima.tr2","Diabetes in Pima Indian Women"
"MASS","Rabbit","Blood Pressure in Rabbits"
"MASS","Rubber","Accelerated Testing of Tyre Rubber"
"MASS","SP500","Returns of the Standard and Poors 500"
"MASS","Sitka","Growth Curves for Sitka Spruce Trees in 1988"
"MASS","Sitka89","Growth Curves for Sitka Spruce Trees in 1989"
"MASS","Skye","AFM Compositions of Aphyric Skye Lavas"
"MASS","Traffic","Effect of Swedish Speed Limits on Accidents"
"MASS","UScereal","Nutritional and Marketing Information on US Cereals"
"MASS","UScrime","The Effect of Punishment Regimes on Crime Rates"
"MASS","VA","Veteran's Administration Lung Cancer Trial"
"MASS","abbey","Determinations of Nickel Content"
"MASS","accdeaths","Accidental Deaths in the US 1973-1978"
"MASS","anorexia","Anorexia Data on Weight Change"
"MASS","bacteria","Presence of Bacteria after Drug Treatments"
"MASS","beav1","Body Temperature Series of Beaver 1"
"MASS","beav2","Body Temperature Series of Beaver 2"
"MASS","biopsy","Biopsy Data on Breast Cancer Patients"
"MASS","birthwt","Risk Factors Associated with Low Infant Birth Weight"
"MASS","cabbages","Data from a cabbage field trial"
"MASS","caith","Colours of Eyes and Hair of People in Caithness"
"MASS","cats","Anatomical Data from Domestic Cats"
"MASS","cement","Heat Evolved by Setting Cements"
"MASS","chem","Copper in Wholemeal Flour"
"MASS","coop","Co-operative Trial in Analytical Chemistry"
"MASS","cpus","Performance of Computer CPUs"
"MASS","crabs","Morphological Measurements on Leptograpsus Crabs"
"MASS","deaths","Monthly Deaths from Lung Diseases in the UK"
"MASS","drivers","Deaths of Car Drivers in Great Britain 1969-84"
"MASS","eagles","Foraging Ecology of Bald Eagles"
"MASS","epil","Seizure Counts for Epileptics"
"MASS","farms","Ecological Factors in Farm Management"
"MASS","fgl","Measurements of Forensic Glass Fragments"
"MASS","forbes","Forbes' Data on Boiling Points in the Alps"
"MASS","galaxies","Velocities for 82 Galaxies"
"MASS","gehan","Remission Times of Leukaemia Patients"
"MASS","genotype","Rat Genotype Data"
"MASS","geyser","Old Faithful Geyser Data"
"MASS","gilgais","Line Transect of Soil in Gilgai Territory"
"MASS","hills","Record Times in Scottish Hill Races"
"MASS","housing","Frequency Table from a Copenhagen Housing Conditions Survey"
"MASS","immer","Yields from a Barley Field Trial"
"MASS","leuk","Survival Times and White Blood Counts for Leukaemia Patients"
"MASS","mammals","Brain and Body Weights for 62 Species of Land Mammals"
"MASS","mcycle","Data from a Simulated Motorcycle Accident"
"MASS","menarche","Age of Menarche in Warsaw"
"MASS","michelson","Michelson's Speed of Light Data"
"MASS","minn38","Minnesota High School Graduates of 1938"
"MASS","motors","Accelerated Life Testing of Motorettes"
"MASS","muscle","Effect of Calcium Chloride on Muscle Contraction in Rat Hearts"
"MASS","newcomb","Newcomb's Measurements of the Passage Time of Light"
"MASS","nlschools","Eighth-Grade Pupils in the Netherlands"
"MASS","npk","Classical N, P, K Factorial Experiment"
"MASS","npr1","US Naval Petroleum Reserve No. 1 data"
"MASS","oats","Data from an Oats Field Trial"
"MASS","painters","The Painter's Data of de Piles"
"MASS","petrol","N. L. Prater's Petrol Refinery Data"
"MASS","phones","Belgium Phone Calls 1950-1973"
"MASS","quine","Absenteeism from School in Rural New South Wales"
"MASS","road","Road Accident Deaths in US States"
"MASS","rotifer","Numbers of Rotifers by Fluid Density"
"MASS","ships","Ships Damage Data"
"MASS","shoes","Shoe wear data of Box, Hunter and Hunter"
"MASS","shrimp","Percentage of Shrimp in Shrimp Cocktail"
"MASS","shuttle","Space Shuttle Autolander Problem"
"MASS","snails","Snail Mortality Data"
"MASS","steam","The Saturated Steam Pressure Data"
"MASS","stormer","The Stormer Viscometer Data"
"MASS","survey","Student Survey Data"
"MASS","synth.te","Synthetic Classification Problem"
"MASS","synth.tr","Synthetic Classification Problem"
"MASS","topo","Spatial Topographic Data"
"MASS","waders","Counts of Waders at 15 Sites in South Africa"
"MASS","whiteside","House Insulation: Whiteside's Data"
"MASS","wtloss","Weight Loss Data from an Obese Patient"
"MassSpecWavelet","exampleMS","An example mass spectrum"
"Matrix","CAex","Albers' example Matrix with ""Difficult"" Eigen Factorization"
"Matrix","KNex","Koenker-Ng Example Sparse Model Matrix and Response Vector"
"Matrix","USCounties","USCounties Contiguity Matrix"
"Matrix","wrld_1deg","World 1-degree grid contiguity matrix"
"metap","dat.metap","Example data"
"mgcv","columb","Reduced version of Columbus OH crime data"
"mgcv","columb.polys","Reduced version of Columbus OH crime data"
"mice","boys","Growth of Dutch boys"
"mice","brandsma","Brandsma school data used Snijders and Bosker (2012)"
"mice","employee","Employee selection data"
"mice","fdd","SE Fireworks disaster data"
"mice","fdd.pred","SE Fireworks disaster data"
"mice","fdgs","Fifth Dutch growth study 2009"
"mice","leiden85","Leiden 85+ study"
"mice","mammalsleep","Mammal sleep data"
"mice","mnar_demo_data","MNAR demo data"
"mice","nhanes","NHANES example - all variables numerical"
"mice","nhanes2","NHANES example - mixed numerical and discrete variables"
"mice","pattern1","Datasets with various missing data patterns"
"mice","pattern2","Datasets with various missing data patterns"
"mice","pattern3","Datasets with various missing data patterns"
"mice","pattern4","Datasets with various missing data patterns"
"mice","popmis","Hox pupil popularity data with missing popularity scores"
"mice","pops","Project on preterm and small for gestational age infants (POPS)"
"mice","pops.pred","Project on preterm and small for gestational age infants (POPS)"
"mice","potthoffroy","Potthoff-Roy data"
"mice","selfreport","Self-reported and measured BMI"
"mice","tbc","Terneuzen birth cohort"
"mice","tbc.target","Terneuzen birth cohort"
"mice","toenail","Toenail data"
"mice","toenail2","Toenail data"
"mice","walking","Walking disability data"
"mice","windspeed","Subset of Irish wind speed data"
"mitml","justice","Example data set on employees' justice perceptions and satisfaction"
"mitml","leadership","Example data set on leadership style and job satisfaction"
"mitml","studentratings","Example data set on student ratings and achievement"
"mitools","pisamaths","Maths Performance Data from the PISA 2012 survey in New Zealand"
"mitools","smi","Multiple imputations"
"modeldata","Chicago","Chicago ridership data"
"modeldata","Sacramento","Sacramento CA home prices"
"modeldata","Smithsonian","Smithsonian museums"
"modeldata","ad_data","Alzheimer's disease data"
"modeldata","ames","Ames Housing Data"
"modeldata","attrition","Job attrition"
"modeldata","biomass","Biomass data"
"modeldata","bivariate_test (bivariate)","Example bivariate classification data"
"modeldata","bivariate_train (bivariate)","Example bivariate classification data"
"modeldata","bivariate_val (bivariate)","Example bivariate classification data"
"modeldata","car_prices","Kelly Blue Book resale data for 2005 model year GM cars"
"modeldata","cat_adoption","Cat Adoption"
"modeldata","cells","Cell body segmentation"
"modeldata","check_times","Execution time data"
"modeldata","chem_proc_yield","Chemical manufacturing process data set"
"modeldata","concrete","Compressive strength of concrete mixtures"
"modeldata","covers","Raw cover type data"
"modeldata","credit_data","Credit data"
"modeldata","crickets","Rates of Cricket Chirps"
"modeldata","deliveries","Food Delivery Time Data"
"modeldata","drinks","Sample time series data"
"modeldata","grants_2008 (grants)","Grant acceptance data"
"modeldata","grants_other (grants)","Grant acceptance data"
"modeldata","grants_test (grants)","Grant acceptance data"
"modeldata","hepatic_injury_qsar","Predicting hepatic injury from chemical information"
"modeldata","hotel_rates","Daily Hotel Rate Data"
"modeldata","hpc_cv","Class probability predictions"
"modeldata","hpc_data","High-performance computing system data"
"modeldata","ischemic_stroke","Clinical data used to predict ischemic stroke"
"modeldata","leaf_id_flavia","Leaf identification data (Flavia)"
"modeldata","lending_club","Loan data"
"modeldata","meats","Fat, water and protein content of meat samples"
"modeldata","mlc_churn","Customer churn data"
"modeldata","oils","Fatty acid composition of commercial oils"
"modeldata","parabolic","Parabolic class boundary data"
"modeldata","pathology","Liver pathology data"
"modeldata","pd_speech","Parkinson's disease speech classification data set"
"modeldata","penguins","Palmer Station penguin data"
"modeldata","permeability_qsar","Predicting permeability from chemical information"
"modeldata","scat","Morphometric data on scat"
"modeldata","solubility_test","Solubility predictions from MARS model"
"modeldata","stackoverflow","Annual Stack Overflow Developer Survey Data"
"modeldata","stations (Chicago)","Chicago ridership data"
"modeldata","steroidogenic_toxicity","Predicting steroidogenic toxicity with assay data"
"modeldata","tate_text","Tate Gallery modern artwork metadata"
"modeldata","taxi","Chicago taxi data set"
"modeldata","testing_data (small_fine_foods)","Fine foods example data"
"modeldata","training_data (small_fine_foods)","Fine foods example data"
"modeldata","two_class_dat","Two class data"
"modeldata","two_class_example","Two class predictions"
"modeldata","wa_churn","Watson churn data"
"ModelMetrics","testDF","Test data"
"modelr","heights","Height and income data."
"modelr","sim1","Simple simulated datasets"
"modelr","sim2","Simple simulated datasets"
"modelr","sim3","Simple simulated datasets"
"modelr","sim4","Simple simulated datasets"
"MotrpacRatTraining6mo","STOPWORDS","Stop words"
"MotrpacRatTraining6moData","ACETYL_HEART_DA","Differential analysis of proteomics datasets"
"MotrpacRatTraining6moData","ACETYL_HEART_NORM_DATA","Normalized protein acetylation data"
"MotrpacRatTraining6moData","ACETYL_LIVER_DA","Differential analysis of proteomics datasets"
"MotrpacRatTraining6moData","ACETYL_LIVER_NORM_DATA","Normalized protein acetylation data"
"MotrpacRatTraining6moData","ACETYL_META","Proteomics sample-level metadata"
"MotrpacRatTraining6moData","ASSAY_ABBREV","Assay or ""ome"" abbreviations"
"MotrpacRatTraining6moData","ASSAY_ABBREV_TO_CODE","Assay abbreviation-to-code mapping"
"MotrpacRatTraining6moData","ASSAY_CODE_TO_ABBREV","Assay code-to-abbreviation mapping"
"MotrpacRatTraining6moData","ASSAY_COLORS","Assay colors"
"MotrpacRatTraining6moData","ASSAY_ORDER","Assay order"
"MotrpacRatTraining6moData","ATAC_BAT_NORM_DATA_05FDR","Normalized ATAC-seq data for training-regulated features"
"MotrpacRatTraining6moData","ATAC_HEART_NORM_DATA_05FDR","Normalized ATAC-seq data for training-regulated features"
"MotrpacRatTraining6moData","ATAC_HIPPOC_NORM_DATA_05FDR","Normalized ATAC-seq data for training-regulated features"
"MotrpacRatTraining6moData","ATAC_KIDNEY_NORM_DATA_05FDR","Normalized ATAC-seq data for training-regulated features"
"MotrpacRatTraining6moData","ATAC_LIVER_NORM_DATA_05FDR","Normalized ATAC-seq data for training-regulated features"
"MotrpacRatTraining6moData","ATAC_LUNG_NORM_DATA_05FDR","Normalized ATAC-seq data for training-regulated features"
"MotrpacRatTraining6moData","ATAC_META","ATAC-seq metadata and QC"
"MotrpacRatTraining6moData","ATAC_SKMGN_NORM_DATA_05FDR","Normalized ATAC-seq data for training-regulated features"
"MotrpacRatTraining6moData","ATAC_WATSC_NORM_DATA_05FDR","Normalized ATAC-seq data for training-regulated features"
